<?xml version="1.0" encoding="UTF-8"?>
<!DOCTYPE System SYSTEM "usuariosUnix.dtd">
<System>
    <User nombre="user1" passwd="cotraseña" directorio="HOME" uid="u1" shell="BASH" grupoPrincipal=" g1" grupoSecundario=" g4"/>
    <User nombre="user2" passwd="cotraseña" directorio="HOME" uid="u2" shell="BASH" grupoPrincipal=" g2" grupoSecundario=" g4"/>
    <User nombre="user3" passwd="cotraseña" directorio="HOME" uid="u3" shell="BASH" grupoPrincipal=" g1"/>
    <User nombre="user4" passwd="cotraseña" directorio="HOME" uid="u4" shell="BASH" grupoPrincipal=" g2"/>
    <User nombre="user5" passwd="cotraseña" directorio="HOME" uid="u5" shell="BASH" grupoPrincipal=" g1"/>
    <User nombre="user6" passwd="cotraseña" directorio="HOME" uid="u6" shell="BASH" grupoPrincipal=" g2"/>
    <Group nombre="grupo1" idusuarios=" u1 u3 u5" gid="g1"/>
    <Group nombre="grupo2" idusuarios=" u2 u4 u6" gid="g2"/>
    <Group nombre="grupo3" gid="g3"/>
    <Group nombre="grupo4" idusuarios=" u1 u2" gid="g4"/>
    <Group nombre="ElMejorGrupo" idusuarios=" u1" gid="g1000"/>
</System>
