<?xml version="1.0" encoding="UTF-8"?>
<!DOCTYPE System SYSTEM "usuariosUnix.dtd" >
<System>
  <User nombre='user1' passwd="cotraseña" directorio="HOME" uid="u01" grupoPrincipal="g01" grupoSecundario="g04"/>
  <User nombre="user2" passwd="cotraseña" directorio="HOME" uid="u02" grupoPrincipal="g02" grupoSecundario="g04"/>
  <User nombre="user3" passwd="cotraseña" directorio="HOME" uid="u03" grupoPrincipal="g01"/>
  <User nombre="user4" passwd="cotraseña" directorio="HOME" uid="u04" grupoPrincipal="g02"/>
  <User nombre="user5" passwd="cotraseña" directorio="HOME" uid="u05" grupoPrincipal="g01"/>
  <User nombre="user6" passwd="cotraseña" directorio="HOME" uid="u06" grupoPrincipal="g02"/>	
  
  
  <Group nombre="grupo1" idusuarios="u01 u03 u05" gid="g01"/>
  <Group nombre="grupo2" idusuarios="u02 u04 u07" gid="g02"/>
  <Group nombre="grupo3" gid="g03"/>
  <Group nombre="grupo4" idusuarios="u01 u02" gid="g04"/>
</System>
